name,type,img,description,effect
Broad-Bellied,trait,cowled,"Your staggering girth has gifted you with the ability to haul anything without breaking a sweat. Unfortunately, it also means that every Halfling you meet wants you to help them move from their old hovel to a new one.","You entirely ignore the effects of Overage, unless the value is in excess of two times your Initiative or Movement."
Cast Iron Stomach,trait,cowled,"The most important part of an Ogre’s biology is their gut. Their heavily muscled bellies contain most of their vital organs. Their stomachs are also monstrously powerful and able to digest nearly anything, a natural mutation resulting from generations of extreme gluttony.","You can gain sustenance from eating literally anything, including inanimate objects.This protects you from starvation entirely, as described in Chapter 9: Hazards & Healing."
Cruisin' For A Bruisin',trait,cowled,"Some Ogres have reaped the full benefits of their omnivorous diets from birth – mother’s milk, raw meat, dirt, Elven trinkets, swamp gas, human livers and tears – and are infused with great size and physical potency.","You may reference either [BB] or [CB] with any melee weapons you wield, including those which possess the Throwing Quality."
Frightening Bellow,trait,cowled,"Ogre lungs are nearly as powerful as Ogre
stomachs. Lots of decibels are required to
fully celebrate the glory of beheading a foe or
gutting a fawn for a tasty treat. This gives
them amazing vocal capabilities, letting
them rip out massive and terrifying roars as intimidation.","Whenever you succeed at an Intimidate Test, the foes you intimidated also suffer from Stress. If it is a Critical Success, they suffer from Fear instead."
Gut-Plate,trait,cowled,"Your great belly is covered in an outer carapace of bones and muscles. Unfortunately, it makes for an easy target. Fortunately, it protects you from most blows.","Whenever unarmored, add +2 to your Damage Threshold as if you were wearing a suit of leather armor. You also gain the benefits of the Natural Quality in these cases."
Hunger Pangs,trait,cowled,Ogres often forget their gustatory exploits until faced with extreme situations. Bracing flashbacks of these orgiastic meals are then triggered – mandrake root; rivers of mead; endless heaps of meat!,"Whenever you successfully Resist the effects of Stress, Fear, Terror or other effects that force you to make a Resolve Test, you immediately gain the benefits of one dose of mandrake root. If this is a Critical Success, you gain the benefits of three doses instead. When under Hunger Pang’s effects, you do not suffer the drawbacks normally associated with taking mandrake root."
Mighty Thews,trait,cowled,"Ogres are all massive, but many possess tiny hands. However, a rarer breed has hands in proportion to the rest of their body. These mighty specimens can easily handle turning the spit over a fire on their own.","You are able to wield any two-handed melee weapon with one hand.This also means you may freely take advantage of the Adaptable Quality for weapons using one hand. Whenever you gain the benefits of the Adaptable Quality, you may add +2 to Total Damage, instead of the normal +1."
Odd Couple,trait,cowled,"Not many trust Ogres, but they have found an unlikely ally in Halflings. Perhaps it is their mutual love of food and alcohol, or even commiseration about being underdogs. Either way, ‘civilized ’ Ogres dwell in Halfling settlements, and their attitude towards each other is more a friendly rivalry than actual pure camaraderie.","When fighting alongside Halfling allies, you gain a +10 Base Chance to strike with Attack Actions and Perilous Stunts."
Rotgut Spray,trait,cowled,"Ogres have a natural predilection towards drink. Due to their almost furnace-like guts, they can ignite any alcohol they ingest to shoot it back out as a gout of flame. This is both very dangerous
and quite entertaining.","After consuming an entire bottle of rotgut, you can belch it up as flaming breath. Treat this breath as a bottle bomb. However, you must immediately
make a Toughness Test or become Intoxicated."
Slamdance,trait,cowled,"By bringing a powerful, hammy fist downwards to crush a foe, they also let fly their flintstone-like feet. This generally puts their enemies right where they want them: on the ground,
ready for skewering.","Whenever you make a successful Stunning Blow, you force a foe to Resist a Takedown as well. You must attack with weapons possessing the Pummeling or Weak Quality to utilize this Talent."
Thick Lining,trait,cowled,"Butchers, hunters and meal-preparers are some of the most important people in Ogre society. Those whose job it is to slaughter often expose themselves to the deadly natural poisons of tainted meats. Their constant work with natural poisons have made them immune to them, and some even prefer the tangy taste.",You are immune to Poisons of all types.
Wendigo,trait,cowled,"Some Ogres in northern regions have grown protective layers of blubber fat and thick white hair grows in large tufts all over their bodies. These Ogres are often called Wendigo and they are isolationist and even a little xenophobic. However, none are better at navigating cold steppes and tundra.","You are immune from the effects of Frostbite, and automatically succeed at Toughness Tests to withstand cold weather."